{
  "schemaVersion": "1.0.0",
  "taskId": "task-001",
  "agentId": "embedded-systems",
  "status": "success",
  "summary": "Power estimate completed",
  "artifacts": [
    {
      "artifactId": "art-001",
      "kind": "power-estimate",
      "uri": "knowledge://fixtures/power-estimate-demo.json"
    }
  ]
}
